{
  "schema": 1,
  "id": "stroop-from-the-front",
  "title": "Stroop, from the front",
  "setting": "lecture",
  "summary": "A ten-minute lecture demonstration: the whole room predicts, one volunteer runs the short Stroop activity on the projector, and the class reads the difference score before it is explained.",
  "author": "Open Psychology Interactives",
  "intro": "This lesson is written to be run on the lecture-theatre screen with one volunteer at the keyboard. Everyone else predicts first and writes one sentence at the end. It takes about ten minutes.\n\nIf you are reading this on your own device instead, follow the same steps yourself.",
  "steps": [
    {
      "type": "note",
      "text": "**Before anything runs.** A word will appear in a colour. The task is to name the *colour*, not read the word. Sometimes the word and the colour agree; sometimes they clash.\n\nWrite down your prediction: how much slower, in milliseconds, will responses be when the word and the colour clash? Commit to a number."
    },
    {
      "type": "activity",
      "edition": "simplified",
      "module": "cognitive",
      "tool": "06-stroop-interference-lab",
      "instructions": "Volunteer: run the six practice trials, then the scored block; results are withheld until it ends. Everyone else: watch the screen, not the volunteer's hands. When the figure appears, read the three condition means aloud before anyone explains them."
    },
    {
      "type": "question",
      "prompt": "What was the interference cost in milliseconds, and how does it compare with the number you wrote down?",
      "kind": "short"
    },
    {
      "type": "question",
      "prompt": "The neutral condition gives a baseline. Why is the difference between congruent and incongruent trials alone not enough to say whether the clash slowed people down or the match sped them up?",
      "kind": "long"
    }
  ]
}
