{
  "schema": 1,
  "id": "what-a-p-value-is-not",
  "title": "What a p-value is not",
  "setting": "seminar",
  "summary": "Two activities and three written answers for a methods seminar: build the sampling distribution a p-value is read from, then see what sample size does to the same observed difference.",
  "author": "Open Psychology Interactives",
  "intro": "Work through the two activities in order and write your answers to the questions as you go. Bring your answers to the seminar. Nothing you type here is sent anywhere: download or copy your answers at the end.\n\nYou will need about 20 minutes.",
  "steps": [
    {
      "type": "note",
      "text": "Before you touch anything: two groups of 40 people are drawn from exactly the same population. The true difference between them is zero. **Write down how big a difference between the two group means would surprise you.**"
    },
    {
      "type": "activity",
      "edition": "simplified",
      "module": "research-methods",
      "tool": "08-sampling-distribution-pvalue-simulator",
      "instructions": "Run 1,000 studies at the default settings and look at the pile. Then raise *Per group* to 200 without moving anything else, and watch the p-value."
    },
    {
      "type": "question",
      "prompt": "The observed difference did not change when you raised the sample size. Why did the p-value change?",
      "kind": "long"
    },
    {
      "type": "activity",
      "edition": "original",
      "module": "research-methods",
      "tool": "17-statistical-power-type-m-lab",
      "instructions": "Answer the prediction question first. Then find the smallest sample size at which a true effect of the default size is found more often than it is missed."
    },
    {
      "type": "question",
      "prompt": "In one sentence: what is a p-value conditional on?",
      "kind": "short"
    },
    {
      "type": "question",
      "prompt": "A study reports p = .30 and concludes there is no effect. What is wrong with that sentence, and what would you write instead?",
      "kind": "long"
    }
  ]
}
